describe,evaluate,introduce,movie_name,serial_number,star
所谓爱情，就是话唠一路，都不会心生腻烦，彼此嫌弃。,132676人评价,2013/美国/剧情爱情,爱在午夜降临前,220,8.8
中国版《两杆大烟枪》。,357389人评价,2006/中国大陆香港/喜剧犯罪,疯狂的石头,221,8.3
生命不止，摇滚不死。,177578人评价,2009/英国德国法国/剧情喜剧音乐,海盗电台,222,8.6
世界上有那么多女人那么多酒馆，但她偏偏走进我的这家。,137409人评价,1942/美国/剧情爱情战争,卡萨布兰卡,223,8.6
当发哥的风衣、墨镜出现在了凯奇身上⋯⋯,234751人评价,1997/美国/动作科幻犯罪惊悚,变脸,224,8.4
生病的E.T.皮肤的颜色就像柿子饼。,171781人评价,1982/美国/剧情科幻,E.T. 外星人,225,8.5
我完全康复了。,203183人评价,1971/英国美国/犯罪剧情科幻,发条橙,226,8.5
最棒的西部片。,58093人评价,1966/意大利西班牙西德/冒险西部,黄金三镖客,227,9.1
每个人的内心都是深不可测的大海。 ,203431人评价,1999/美国/剧情爱情家庭,美国丽人,228,8.5
小成本大魅力。,210136人评价,2013/美国英国/科幻悬疑惊悚,彗星来的那一夜,229,8.4
出门必备：本草纲目。,139482人评价,2007/美国/冒险传记剧情,荒野生存,230,8.6
"In memory, love lives forever...",187842人评价,1996/美国英国/爱情剧情战争,英国病人,231,8.5
每个美丽事物背后都是滴血的现实。,150791人评价,2006/美国德国/剧情惊悚冒险,血钻,232,8.5
新闻人的理性求真。,143893人评价,2015/美国/剧情传记,聚焦,233,8.8
皇上无话儿。,374267人评价,2010/英国澳大利亚美国/剧情传记历史,国王的演讲,234,8.3
最美的飞翔。,55321人评价,2001/法国德国意大利西班牙瑞士/纪录片,迁徙的鸟,235,9.1
我不信仰上帝，但我敬畏上帝。,129205人评价,1995/德国美国/剧情犯罪悬疑惊悚,非常嫌疑犯,236,8.6
热血沸腾，相当完美的娱乐拳击大餐。,94878人评价,2011/美国/剧情运动家庭,勇士,237,8.9
现实与童话交相辉映的旅程。,114101人评价,1996/日本/犯罪剧情,燕尾蝶,238,8.6
还原真实而残酷的战争。,131874人评价,2001/美国/动作历史战争,黑鹰坠落,239,8.6
用剩余不多的时间，去燃烧整个生命。,147095人评价,2007/美国/冒险喜剧剧情,遗愿清单,240,8.5
大卫·林奇的梦境迷宫。,256233人评价,2001/法国美国/剧情悬疑惊悚,穆赫兰道,241,8.3
你要相信，这世上真的有爱存在，不管在什么年纪 ,65750人评价,2011/韩国/剧情爱情,我爱你,242,9.0
乐观比一切都有力量。,118177人评价,2008/美国/剧情传记,叫我第一名,243,8.6
一群演技精湛的戏骨，奉献出一个精致的黑帮小品，成就杜琪峰群戏的巅峰之作。,110438人评价,1999/香港/剧情动作犯罪,枪火,244,8.6
一个人的独角戏。,151004人评价,2000/美国/冒险剧情,荒岛余生,245,8.5
现代科幻电影的开山之作，最伟大导演的最伟大影片。,107112人评价,1968/英国美国/科幻惊悚冒险,2001太空漫游,246,8.7
纯净原始的笑与感动。,104184人评价,1980/博茨瓦纳南非/喜剧,上帝也疯狂,247,8.7
一部能引人思考的科幻励志片。,97475人评价,1997/美国/剧情科幻惊悚,千钧一发,248,8.7
捍卫人权只是信仰，一点不妨碍其行为的残忍。,106412人评价,2003/美国德国英国/剧情犯罪悬疑,大卫·戈尔的一生,249,8.6
青春的窃窃私语。 ,290778人评价,2002/台湾法国/剧情爱情同性,蓝色大门,250,8.3
